uri,dc.identifier,collections,notation,prefLabel,altLabel,broader,broaderTransitive,broadMatch,changeNote,closeMatch,definition,note,exactMatch,example,hiddenLabel,historyNote,inScheme,mappingRelation,editorialnote,related,relatedMatch,scopeNote,semanticRelation,topConceptOf,seeAlso
conceptscheme:plasticiteittype,be.vlaanderen.bodemenondergrond.data.id.conceptscheme.plasticiteittype,,,Conceptschema plasticiteittype,,,,,,,Indicatie van plasticiteittype.,,,,,,,,,,,,,,
concept:nietplastisch,be.vlaanderen.bodemenondergrond.data.id.concept.plasticiteittype.nietplastisch,,nietplastisch,niet plastisch,,,,,,,"De grond laat het niet toe om een rolletje te maken van 3 mm.","Definitie afgeleid van NBN EN ISO 14688-1:2018 en vooral van toepassing voor fijne gronden zoals klei en silt.",,,,,conceptscheme:plasticiteittype,,,,,,,conceptscheme:plasticiteittype,"https://app.nbn.be/data/r/platform/frontend/detail?p40_id=189507&p40_language_code=nl&p40_detail_id=85507"
concept:weinigplastisch,be.vlaanderen.bodemenondergrond.data.id.concept.plasticiteittype.nietplastisch,,weinigplastisch,weinig plastisch,,,,,,,"De grond laat het nauwelijks toe om een rolletje te maken van 3 mm. De grond kan niet meer worden samengekneed als het droger is dan de plasticiteitsgrens.","Definitie afgeleid van NBN EN ISO 14688-1:2018 en vooral van toepassing voor fijne gronden zoals klei en silt.",,,,,conceptscheme:plasticiteittype,,,,,,,conceptscheme:plasticiteittype,"https://app.nbn.be/data/r/platform/frontend/detail?p40_id=189507&p40_language_code=nl&p40_detail_id=85507"
concept:matigplastisch,be.vlaanderen.bodemenondergrond.data.id.concept.plasticiteittype.matigplastisch,,matigplastisch,matig plastisch,,,,,,,"De grond laat het toe om eenvoudig een rolletje van 3 mm te maken. Het duurt niet lang om de plasticiteitsgrens te bereiken waarna de grond verkruimelt en niet meer gerold kan worden tot een streng van 3 mm.","Definitie afgeleid van NBN EN ISO 14688-1:2018 en vooral van toepassing voor fijne gronden zoals klei en silt.",,,,,conceptscheme:plasticiteittype,,,,,,,conceptscheme:plasticiteittype,"https://app.nbn.be/data/r/platform/frontend/detail?p40_id=189507&p40_language_code=nl&p40_detail_id=85507"
concept:sterkplastisch,be.vlaanderen.bodemenondergrond.data.id.concept.plasticiteittype.sterkplastisch,,sterkplastisch,sterk plastisch,,,,,,,"De grond kan lang worden gekneed en gerold voordat de plasticiteitsgrens is bereikt. Daarna kan de grond nog enige keren worden uitgerold en verkneed zonder te verkruimelen. ","Definitie afgeleid van NBN EN ISO 14688-1:2018 en vooral van toepassing voor fijne gronden zoals klei en silt.",,,,,conceptscheme:plasticiteittype,,,,,,,conceptscheme:plasticiteittype,"https://app.nbn.be/data/r/platform/frontend/detail?p40_id=189507&p40_language_code=nl&p40_detail_id=85507"
concept:plastisch,be.vlaanderen.bodemenondergrond.data.id.concept.plasticiteittype.plastisch,,plastisch,plastisch,,,,,,,"De grond laat toe om eenvoudig een rolletje te maken van 3 mm. De mate van de plasticiteit is niet verder gespecificeerd.","Deze waarde werd algemeen gebruikt voordat de norm NBN EN ISO 14688-1:2018 in voege trad en werd behouden vanwege historisch gebruik. Deze waarde is niet geldig wanneer de beschrijving conform de norm gebeurt.",,,,,conceptscheme:plasticiteittype,,,,,,,conceptscheme:plasticiteittype,""

